{
  "authorization_version": "0.1",
  "receipt_id": "grant-fs-write-work",
  "kind": "authorization-grant",
  "principal": { "id": "user:zain", "role": "operator" },
  "agent": { "id": "agent:claude-opus-4-8" },
  "intent": "Write the demo configuration file under /work.",
  "scope": {
    "allowed_actions": ["fs.write"],
    "allowed_targets": ["/work/config.json"],
    "max_actions": 5
  },
  "granted_at": "2026-07-01T00:00:00+00:00",
  "expires_at": "2026-12-31T23:59:59+00:00",
  "revoked": false
}
